<?xml version="1.0" standalone="no"?>
<!--
This file is part of Volantis Mobility Server. 

Volantis Mobility Server is free software: you can redistribute it and/or modify
it under the terms of the GNU General Public License as published by
the Free Software Foundation, either version 3 of the License, or
(at your option) any later version.

Volantis Mobility Server is distributed in the hope that it will be useful,
but WITHOUT ANY WARRANTY; without even the implied warranty of
MERCHANTABILITY or FITNESS FOR A PARTICULAR PURPOSE.  See the
GNU General Public License for more details.

You should have received a copy of the GNU General Public License
along with Volantis Mobility Server.  If not, see <http://www.gnu.org/licenses/>. 
-->

<!DOCTYPE script SYSTEM "script.dtd">

<script title="Selection-driven aggregation value tests (on bottom)">

<applySelection
  expected="Simplest possible non-empty aggregation">
  <topA>
    <middleA>
      <bottomA bottom1="aggOK" bottom3="notSupp" bottom2="differs-1">
      </bottomA>
    </middleA>
  </topA>
  <topA>
    <middleA>
      <bottomA bottom2="differs-2" bottom3="notSupp" bottom1="aggOK">
      </bottomA>
    </middleA>
  </topA>
</applySelection>

<checkProxy name="bottomA" recurse="n"
  expected="one aggregated value">
  <bottomA bottom1="aggOK" bottom2="">
  </bottomA>
</checkProxy>

<applySelection
  expected="Empty aggregation because first one empty">
  <topA>
    <middleA>
      <bottomA bottom1="">
      </bottomA>
    </middleA>
  </topA>
  <topA>
    <middleA>
      <bottomA bottom1="noAgg">
      </bottomA>
    </middleA>
  </topA>
  <topA>
    <middleA>
      <bottomA bottom1="noAgg">
      </bottomA>
    </middleA>
  </topA>
</applySelection>

<checkProxy name="bottomA" recurse="n"
  expected="check bottom1 still empty">
  <bottomA bottom1="" bottom2="">
  </bottomA>
</checkProxy>

<applySelection
  expected="Empty aggregation because second one empty">
  <topA>
    <middleA>
      <bottomA bottom1="noAgg">
      </bottomA>
    </middleA>
  </topA>
  <topA>
    <middleA>
      <bottomA bottom1="">
      </bottomA>
    </middleA>
  </topA>
  <topA>
    <middleA>
      <bottomA bottom1="noAgg">
      </bottomA>
    </middleA>
  </topA>
</applySelection>

<checkProxy name="bottomA" recurse="n"
  expected="check bottom1 still empty">
  <bottomA bottom1="" bottom2="">
  </bottomA>
</checkProxy>

<applySelection
  expected="Empty aggregation because last one empty">
  <topA>
    <middleA>
      <bottomA bottom1="noAgg">
      </bottomA>
    </middleA>
  </topA>
  <topA>
    <middleA>
      <bottomA bottom1="noAgg">
      </bottomA>
    </middleA>
  </topA>
  <topA>
    <middleA>
      <bottomA bottom1="">
      </bottomA>
    </middleA>
  </topA>
</applySelection>

<checkProxy name="bottomA" recurse="n"
  expected="check bottom1 still empty">
  <bottomA bottom1="" bottom2="">
  </bottomA>
</checkProxy>

<applySelection
  expected="Empty aggregation because second one different">
  <topA>
    <middleA>
      <bottomA bottom1="noAgg">
      </bottomA>
    </middleA>
  </topA>
  <topA>
    <middleA>
      <bottomA bottom1="noAgg2">
      </bottomA>
    </middleA>
  </topA>
  <topA>
    <middleA>
      <bottomA bottom1="noAgg">
      </bottomA>
    </middleA>
  </topA>
</applySelection>

<checkProxy name="bottomA" recurse="n"
  expected="check bottom1 still empty">
  <bottomA bottom1="" bottom2="">
  </bottomA>
</checkProxy>

<applySelection
  expected="Empty aggregation because first one missing">
  <topA>
  </topA>
  <topA>
    <middleA>
      <bottomA bottom1="noAgg">
      </bottomA>
    </middleA>
  </topA>
  <topA>
    <middleA>
      <bottomA bottom1="noAgg">
      </bottomA>
    </middleA>
  </topA>
</applySelection>

<checkProxy name="bottomA" recurse="n"
  expected="check bottom1 still empty">
  <bottomA bottom1="" bottom2="">
  </bottomA>
</checkProxy>

<applySelection
  expected="Empty aggregation because second one missing">
  <topA>
    <middleA>
      <bottomA bottom1="noAgg">
      </bottomA>
    </middleA>
  </topA>
  <topA>
  </topA>
  <topA>
    <middleA>
      <bottomA bottom1="noAgg">
      </bottomA>
    </middleA>
  </topA>
</applySelection>

<checkProxy name="bottomA" recurse="n"
  expected="check bottom1 still empty">
  <bottomA bottom1="" bottom2="">
  </bottomA>
</checkProxy>

<applySelection
  expected="Empty aggregation because last one missing">
  <topA>
    <middleA>
      <bottomA bottom1="noAgg">
      </bottomA>
    </middleA>
  </topA>
  <topA>
    <middleA>
      <bottomA bottom1="noAgg">
      </bottomA>
    </middleA>
  </topA>
  <topA>
  </topA>
</applySelection>

<checkProxy name="bottomA" recurse="n"
  expected="check bottom1 still empty">
  <bottomA bottom1="" bottom2="">
  </bottomA>
</checkProxy>

<applySelection
  expected="Confidence test that it DOES work when all there">
  <topA>
    <middleA>
      <bottomA bottom1="yesAgg">
      </bottomA>
    </middleA>
  </topA>
  <topA>
    <middleA>
      <bottomA bottom1="yesAgg">
      </bottomA>
    </middleA>
  </topA>
  <topA>
    <middleA>
      <bottomA bottom1="yesAgg">
      </bottomA>
    </middleA>
  </topA>
</applySelection>

<checkProxy name="bottomA" recurse="n"
  expected="check bottom1 still empty">
  <bottomA bottom1="yesAgg" bottom2="">
  </bottomA>
</checkProxy>


<!-- End script -->
</script>



<!--
 ===========================================================================
 Change History
 ===========================================================================
 $Log$

 08-Dec-04	6416/3	ianw	VBM:2004120703 New Build

 08-Dec-04	6416/1	ianw	VBM:2004120703 New Build

 18-Dec-03	2137/3	richardc	VBM:2003120402 Extra tests for event non-generation

 17-Dec-03	2137/1	richardc	VBM:2003120402 Version for initial review (code and test harness)

 ===========================================================================
-->
